{
  "$schema": "http://json-schema.org/draft-07/schema#",
  "$id": "https://hunt-design-lab.local/schemas/art_sets.schema.json",
  "title": "Art set",
  "description": "Shape of presets/<mode>/art_sets/<id>.json. Loaded by presets.loadArtSet. Storage: folder entity. Catalog ids are genre tiles or objects. Prefer 1–4 entries per role (slim packs); roleId links tile_roles for bake/editor.",
  "type": "object",
  "required": ["id"],
  "additionalProperties": true,
  "definitions": {
    "entityId": {
      "type": "string",
      "pattern": "^[a-z][a-z0-9_]{0,79}$",
      "minLength": 1,
      "maxLength": 80
    },
    "anchor": {
      "type": "string",
      "description": "Draw pivot (creature-style). bottom_center for tall props; middle_center for terrain cells.",
      "enum": [
        "top_left",
        "top_center",
        "top_right",
        "middle_left",
        "middle_center",
        "middle_right",
        "bottom_left",
        "bottom_center",
        "bottom_right"
      ]
    },
    "weightedTile": {
      "type": "object",
      "additionalProperties": true,
      "required": ["id"],
      "properties": {
        "id": {
          "type": "string",
          "format": "tile_id",
          "minLength": 1,
          "maxLength": 120,
          "description": "Genre catalog id. Designer Select follows the role: scenery/furniture → objects; terrain → tiles. Entry kind overrides (overlays for path/water families; objects + wallFamily for face walls). One family row uses representative *_wang_15 / *_pole. Alpha thumb (original fallback)."
        },
        "weight": { "type": "number", "minimum": 0 },
        "roleId": {
          "$ref": "#/definitions/entityId",
          "description": "Relation: kind=tile_roles (presets_ids). Soft ref to presets/<mode>/tile_roles/ for bake + editor defaults."
        },
        "kind": {
          "type": "string",
          "enum": ["tiles", "objects", "overlays"],
          "description": "Catalog family. Default from the role key (scenery/furniture → objects; terrain → tiles). overlays = Wang path/water family. objects + wallFamily = P4 faces. Select writes this when you pick an asset."
        },
        "wangFamily": {
          "type": "string",
          "enum": ["", "dirt", "water", "cobble"],
          "description": "Overlay family token. Set when kind is overlays. One art-set row per family; id is the representative *_wang_15. Empty = unset (omit on disk)."
        },
        "wallFamily": {
          "type": "string",
          "pattern": "^$|^[a-z][a-z0-9_]{0,63}$",
          "description": "P4 wall-face family (e.g. stone_wall). Set when kind is objects and the stamp is a wall family. Empty = unset (omit on disk)."
        },
        "wallAlign": {
          "type": "string",
          "enum": ["", "pole", "horizontal", "vertical", "corner"],
          "description": "Representative wall face. Select writes pole; the brush resolves the other faces. Empty = unset (omit on disk)."
        },
        "render": {
          "type": "object",
          "additionalProperties": true,
          "description": "Optional draw override for this row. Beats the linked role.render. MUST use this object — top-level scale/anchor/variant are not read.",
          "properties": {
            "scale": { "type": "number", "minimum": 0.05, "maximum": 8 },
            "anchor": { "$ref": "#/definitions/anchor" },
            "variant": { "type": "string", "minLength": 1, "maxLength": 40 }
          }
        },
        "influence": {
          "type": "object",
          "additionalProperties": true,
          "description": "Optional partial gameplay override for this row. Authored keys beat the linked role.influence. Omitted keys inherit the role (hybrid bake) or the generator channel (procedural bind).",
          "properties": {
            "friction": {
              "type": "integer",
              "minimum": 0,
              "maximum": 255
            },
            "sight": {
              "type": "integer",
              "minimum": 0,
              "maximum": 255
            },
            "flags": {
              "type": "integer",
              "minimum": 0,
              "maximum": 255
            },
            "walkMode": { "type": "string", "enum": ["open", "block"] },
            "sightMode": { "type": "string", "enum": ["clear", "block"] }
          }
        }
      }
    }
  },
  "properties": {
    "id": { "$ref": "#/definitions/entityId" },
    "label": { "type": "string", "minLength": 1, "maxLength": 120 },
    "notes": { "type": "string", "maxLength": 4000 },
    "genre": { "type": "string" },
    "kind": {
      "type": "string",
      "description": "Default catalog kind for entries that omit kind (usually tiles)."
    },
    "roles": {
      "type": "object",
      "description": "Pick lists by decorative key. Procedural bind uses terrain keys only (floor/path/wall/stairs/void|water). Scenery/furniture are editor palette only.",
      "additionalProperties": {
        "type": "array",
        "maxItems": 10,
        "items": {
          "oneOf": [
            {
              "type": "string",
              "format": "tile_id",
              "minLength": 1,
              "description": "Genre tile catalog id. Designer: Select opens the tile catalog."
            },
            { "$ref": "#/definitions/weightedTile" }
          ]
        }
      }
    },
    "rules": {
      "type": "object",
      "additionalProperties": true,
      "properties": {
        "blockedEdgeOnly": { "type": "boolean" },
        "pathMix": { "type": "number", "minimum": 0, "maximum": 1 },
        "walkDefault": { "type": "integer", "minimum": 0, "maximum": 254 }
      }
    }
  }
}
